{
  "archive_policy": {
    "redaction": "none_required",
    "reportability": "internal",
    "retention": "repository_history"
  },
  "attempt_id": "attempt-001",
  "authority_state": "unpromoted",
  "canonicalization_version": "tiber-canonical-json-v1",
  "downstream_authority": "none",
  "job_id": "keenan-allen-ind-signing",
  "job_version": "v1",
  "json_file_version": "tiber-json-file-v1",
  "predecessor_attempt_ref": null,
  "raw_hash_version": "tiber-raw-sha256-v1",
  "renderer_version": "tiber-packet-markdown-v1",
  "review_ref": {
    "digest": "sha256:3cb37cd2d1790ce6237dbcce52f2f1b0992ad0e0484e52e4c99a124661b37cb3",
    "digest_mode": "tiber-canonical-json-v1",
    "path": "runs/keenan-allen-ind-signing-v0/attempts/attempt-001/review.json"
  },
  "run_id": "keenan-allen-ind-signing-v0",
  "schema_version": "research-seal/v0",
  "sealed_at": "2026-08-18T22:25:00Z",
  "submission_ref": {
    "digest": "sha256:b85659d246c99cecd20835a6e0073954ff46bd93ee49187a0beccb1c5b536d1b",
    "digest_mode": "tiber-canonical-json-v1",
    "path": "runs/keenan-allen-ind-signing-v0/attempts/attempt-001/submission.json"
  },
  "successor_attempt_ref": null,
  "synthetic_fixture": false,
  "terminal_state": {
    "attempt_state": "sealed",
    "process_terminal": "completed",
    "review_verdict": "rework_required"
  },
  "validator_version": "tiber-research-validator-v0"
}
